Sheet: Sheet1
A1: Reference | B1: Part Number | C1: Mfg Part Number | D1: Description | E1: Unit Price | F1: Sys Qty | G1: Sys Price | H1: Order Qty | I1: Order Price
A2: C1,C2 | B2: 1572-1218-ND | C2: 334MMR250K | D2: CAP FILM 0.33UF 10% 250VDC RAD | E2: 0.57 | F2: 2 | G2: of:=[.E2]*[.F2] -> 1.14 | H2: 4 | I2: of:=[.H2]*[.E2] -> 2.28
A3: C3 | B3: ‎478-2472-ND‎ | C3: SR215C104KAA‎ | D3: CAP CER 0.1UF 50V X7R RADIAL | E3: 0.28 | F3: 1 | G3: of:=[.E3]*[.F3] -> 0.28 | H3: 2 | I3: of:=[.H3]*[.E3] -> 0.56
A4: C4,C5 | B4: 445-173583-1-ND | C4: FG28X7R1E105KRT06 | D4: CAP CER 1UF 25V X7R RADIAL | E4: 0.45 | F4: 2 | G4: of:=[.E4]*[.F4] -> 0.9 | H4: 4 | I4: of:=[.H4]*[.E4] -> 1.8
A5: D1 | B5: 1655-1514-1-ND | C5: SB140TA | D5: DIODE SCHOTTKY 40V 1A DO41 | E5: 0.35 | F5: 1 | G5: of:=[.E5]*[.F5] -> 0.35 | H5: 2 | I5: of:=[.H5]*[.E5] -> 0.7
A6: D2 | B6: F5659CT-ND | C6: P6KE91CA | D6: TVS DIODE 77.8V 125V DO204AC | E6: 0.64 | F6: 1 | G6: of:=[.E6]*[.F6] -> 0.64 | H6: 2 | I6: of:=[.H6]*[.E6] -> 1.28
A7: IC1 | B7: PIC10F220-I/P-ND | C7: PIC10F220-I/P‎ | D7: IC MCU 8BIT 384B FLASH 8DIP | E7: 0.87 | F7: 1 | G7: of:=[.E7]*[.F7] -> 0.87 | H7: 2 | I7: of:=[.H7]*[.E7] -> 1.74
A8: K1 | B8: PB2032-ND | C8: ORWH-SH-105D1F,000 | D8: RELAY GEN PURPOSE SPDT 10A 5V | E8: 1.75 | F8: 1 | G8: of:=[.E8]*[.F8] -> 1.75 | H8: 2 | I8: of:=[.H8]*[.E8] -> 3.5
A9: OK1 | B9: 160-1350-5-ND | C9: LTV-814H | D9: OPTOISOLATR 5KV TRANSISTOR 4-DIP | E9: 0.7 | F9: 1 | G9: of:=[.E9]*[.F9] -> 0.7 | H9: 2 | I9: of:=[.H9]*[.E9] -> 1.4
A10: Q1 | B10: 2N7000-G-ND | C10: 2N7000-G | D10: MOSFET N-CH 60V 0.2A TO92-3 | E10: 0.53 | F10: 1 | G10: of:=[.E10]*[.F10] -> 0.53 | H10: 2 | I10: of:=[.H10]*[.E10] -> 1.06
A11: R1,R2 | B11: CF14JT1K60CT-ND | C11: CF14JT1K60 | D11: RES 1.6K OHM 1/4W 5% AXIAL | E11: 0.06 | F11: 2 | G11: of:=[.E11]*[.F11] -> 0.12 | H11: 10 | I11: of:=[.H11]*[.E11] -> 0.6
A12: R3 | B12: A105656-ND | C12: CB10LV472M | D12: TRIMMER 4.7KOHM 0.15W PC PIN TOP | E12: 0.6 | F12: 1 | G12: of:=[.E12]*[.F12] -> 0.6 | H12: 2 | I12: of:=[.H12]*[.E12] -> 1.2
A13: R4 | B13: CF14JT100KCT-ND | C13: CF14JT100K | D13: RES 100K OHM 1/4W 5% AXIAL | E13: 0.06 | F13: 1 | G13: of:=[.E13]*[.F13] -> 0.06 | H13: 10 | I13: of:=[.H13]*[.E13] -> 0.6
A14: R5 | B14: MOV-07D201K-ND | C14: MOV-07D201K | D14: VARISTOR 200V 1.2KA DISC 7MM | E14: 0.51 | F14: 1 | G14: of:=[.E14]*[.F14] -> 0.51 | H14: 2 | I14: of:=[.H14]*[.E14] -> 1.02
A15: U1 | B15: 1866-2998-ND | C15: IRM-01-5 | D15: AC/DC CONVERTER 5V 1W | E15: 8.05 | F15: 1 | G15: of:=[.E15]*[.F15] -> 8.05 | H15: 2 | I15: of:=[.H15]*[.E15] -> 16.1
A16: X1 | B16: 732-10957-ND | C16: 691137710004 | D16: TERM BLOCK 4POS SIDE ENTRY 5MM | E16: 1.01 | F16: 1 | G16: of:=[.E16]*[.F16] -> 1.01 | H16: 2 | I16: of:=[.H16]*[.E16] -> 2.02
B17: 1738-1000-ND | C17: FIT0099 | D17: BREADBOARD GENERAL PURPOSE PTH | E17: 2.17 | F17: 1 | G17: of:=[.E17]*[.F17] -> 2.17 | H17: 2 | I17: of:=[.H17]*[.E17] -> 4.34
E18: Total | F18: of:=SUM([.F2:.F17]) -> 19 | G18: of:=SUM([.G2:.G17]) -> 19.68 | H18: of:=SUM([.H2:.H17]) -> 52 | I18: of:=SUM([.I2:.I17]) -> 40.2